Scheme Name,Eligibility,Details,Apply Link,Age,Gender,State,Occupation,Category
National Means-cum-Merit Scholarship (NMMS),"Students of Class VIII with family income below Rs.1.5 lakh per annum, selection through examination","Scholarship of Rs.12,000 per annum for four years for studies in classes IX to XII",https://mhrd.gov.in/nmms,13-15,All,All India,Student,All Categories
Pragati Scholarship Scheme for Girl Students,"Girl students admitted to AICTE-approved technical institutions, family income below Rs.8 lakh per annum","Scholarship of Rs.50,000 per annum for tuition fee and other expenses",https://www.aicte-pragati-saksham-gov.in,Below 30,Female,All India,Student,All Categories
Saksham Scholarship Scheme for Differently Abled Students,"Differently-abled students with 40% disability admitted to AICTE-approved technical institutions, family income below Rs.8 lakh per annum","Scholarship of Rs.50,000 per annum for tuition fee and other expenses",https://www.aicte-pragati-saksham-gov.in,Below 30,All,All India,Student,All Categories (Differently Abled)
Post-Matric Scholarship for OBC Students,OBC students with family income below Rs.1.5 lakh per annum,Financial assistance for pursuing studies after class X,https://scholarships.gov.in,16-32,All,All India,Student,OBC
Post-Matric Scholarship for ST Students,ST students with family income below Rs.2.5 lakh per annum,Financial assistance for ST students pursuing post-matriculation studies,https://scholarships.gov.in,16-32,All,All India,Student,ST
Credit Guarantee Fund Scheme for Education Loans (CGFSEL),"Students admitted to approved higher education institutions in India, family income criteria applicable",Guarantee for education loans up to Rs.7.5 lakh without collateral security and third-party guarantee,https://www.ncgtc.in,Below 35,All,All India,Student,All Categories
Swami Vivekananda Scholarship for Single Girl Child,"Only girl child in the family with no siblings, family income below specified limit",Scholarship for higher education to a single girl child in a family,https://www.ugc.ac.in,18-25,Female,All India,Student,All Categories
INSPIRE Scholarship for Higher Education (SHE),"Students in top 1% in Class XII board exams, pursuing science courses at bachelor's or master's level","Scholarship of Rs.80,000 per annum for pursuing Bachelor and Masters level education in natural and basic sciences",https://online-inspire.gov.in,17-22,All,All India,Student,All Categories
Ishan Uday Scholarship Scheme for North Eastern Region,"Students from North Eastern states with family income below Rs.8 lakh per annum, admitted through general entrance test","Scholarship of Rs.5,400-7,800 per month for general degree courses and technical/professional courses",https://scholarships.gov.in,Below 30,All,North Eastern States,Student,All Categories
Dr. Ambedkar Post-Matric Scholarship for Economically Backward Classes,Students from Economically Backward Classes (non-SC/ST/OBC) with family income below Rs.1 lakh per annum,Financial assistance for pursuing higher education,https://scholarships.gov.in,16-32,All,All India,Student,Economically Backward Classes
PG Scholarship for University Rank Holders,"Students securing first and second positions in undergraduate programs at universities, pursuing postgraduate courses","Scholarship of Rs.3,100 per month for two years for postgraduate studies",https://www.ugc.ac.in,Below 30,All,All India,Student,All Categories
Rajiv Gandhi National Fellowship for SC Students,SC students pursuing M.Phil/PhD with valid UGC-NET or CSIR-NET qualification,Fellowship for pursuing M.Phil and PhD programs,https://socialjustice.gov.in/schemes/29,Below 35,All,All India,Student/Researcher,SC
Rajiv Gandhi National Fellowship for ST Students,ST students pursuing M.Phil/PhD with valid UGC-NET or CSIR-NET qualification,Fellowship for pursuing M.Phil and PhD programs,https://scholarships.gov.in,Below 35,All,All India,Student/Researcher,ST
Maulana Azad National Fellowship for Minority Students,Minority students pursuing M.Phil/PhD with valid UGC-NET or similar qualification,Fellowship for pursuing M.Phil and PhD programs,https://www.minorityaffairs.gov.in/show_content.php?lang=1&level=1&ls_id=625&lid=107,Below 35,All,All India,Student/Researcher,Minorities
National Fellowship for OBC Students,OBC students pursuing M.Phil/PhD with valid UGC-NET or CSIR-NET qualification,Fellowship for pursuing M.Phil and PhD programs,https://scholarships.gov.in,Below 35,All,All India,Student/Researcher,OBC
CSIR Junior Research Fellowship (JRF),Postgraduate students qualified in CSIR-UGC NET for JRF or GATE with specified cut-off marks,"Fellowship of Rs.31,000 per month for first two years and Rs.35,000 per month for remaining tenure",https://csirhrdg.res.in,Below 35,All,All India,Student/Researcher,All Categories
UGC Junior Research Fellowship (JRF),Postgraduate students qualified in UGC-NET for JRF,"Fellowship of Rs.31,000 per month for first two years and Rs.35,000 per month for remaining tenure",https://www.ugc.ac.in,Below 35,All,All India,Student/Researcher,All Categories
DBT Junior Research Fellowship (JRF),Postgraduate students qualified in DBT-JRF examination,Fellowship for research in biotechnology,https://dbtindia.gov.in,Below 35,All,All India,Student/Researcher,All Categories
e-Shodh Sindhu,Students and faculty of member institutions,Access to academic journals and digital resources for research,https://ess.inflibnet.ac.in,All ages,All,All India,Student/Researcher/Faculty,All Categories
National Sports Scholarship,Students with achievements in recognized sports events at national or international level,Scholarships for sports achievers pursuing education,https://yas.nic.in,Dec-25,All,All India,Student/Sportsperson,All Categories
GATE Scholarship,Students admitted to ME/MTech programs through GATE,"Scholarship of Rs.12,400 per month for ME/MTech students in AICTE-approved institutions",https://www.aicte-india.org,Below 35,All,All India,Student,All Categories
Lakshmi Bai Social Security Pension Scheme (Delhi),Girl students from families with annual income below Rs.1 lakh,Monthly pension and financial assistance for education to girl students in Delhi,https://scholarships.delhi.gov.in,Jun-18,Female,Delhi,Student,All Categories
Chief Minister Scholarship Scheme (Himachal Pradesh),"Students with 70% or above marks in qualifying examination, family income criteria applicable",Scholarship for meritorious students,https://himachal.nic.in,Below 25,All,Himachal Pradesh,Student,All Categories
Mukhyamantri Medhavi Vidyarthi Yojana (Madhya Pradesh),"Students with 75% or above marks in Class XII, family income below Rs.6 lakh per annum",Scholarship for higher education in professional courses,https://scholarshipportal.mp.nic.in,Below 25,All,Madhya Pradesh,Student,All Categories
Free Laptop Scheme (Tamil Nadu),Students enrolled in government and government-aided colleges and polytechnics,Free laptop distribution to students in government/aided colleges,https://www.tn.gov.in/scheme,18-25,All,Tamil Nadu,Student,All Categories
Mukhyamantri Yuva Swarozgar Yojana (Uttarakhand),"Graduates/diploma holders from recognized institutions, residents of Uttarakhand",Financial assistance and loan for entrepreneurship,https://uttarakhand.gov.in,18-35,All,Uttarakhand,Student/Entrepreneur,All Categories
Mukhyamantri Rajshri Yojana (Rajasthan),"Girl students from Rajasthan, family income criteria applicable",Financial assistance for girl students at different stages of education,https://rajshri.rajasthan.gov.in,Jun-24,Female,Rajasthan,Student,All Categories
Mukhyamantri Kanya Utthan Yojana (Bihar),"Girl students from Bihar, family income criteria applicable",Financial assistance for girl students at different stages of education,https://wcd.bihar.gov.in,Below 25,Female,Bihar,Student,All Categories
Dr. Ambedkar Medhavi Vidyarthi Yojana (Uttar Pradesh),"Students with 60% or above marks in qualifying examination, family income below Rs.2 lakh per annum",Scholarship for meritorious students,https://scholarship.up.nic.in,Below 30,All,Uttar Pradesh,Student,All Categories
Gyanodaya Scheme (Gujarat),Girl students in rural areas studying in Class 9,Free bicycle distribution to girl students,https://education.gujarat.gov.in,14-16,Female,Gujarat,Student,All Categories
Pragati Scholarship (AICTE),"Girl students admitted to AICTE-approved institutions, family income below Rs.8 lakh per annum",Scholarship for girls pursuing technical education,https://www.aicte-india.org,Below 30,Female,All India,Student,All Categories
Mukhyamantri Balak & Balika Protsahan Yojana (Haryana),Students with specified attendance and academic performance,Cash incentives for students at different educational levels,https://scholarships.gov.in,Jun-18,All,Haryana,Student,All Categories
Pre-Matric Scholarship for SC Students,SC students with family income below Rs.2.5 lakh per annum,Financial assistance for SC students in classes IX and X,https://scholarships.gov.in,14-16,All,All India,Student,SC
Pre-Matric Scholarship for ST Students,ST students with family income below Rs.2.5 lakh per annum,Financial assistance for ST students in classes IX and X,https://scholarships.gov.in,14-16,All,All India,Student,ST
AICTE SWANATH Scholarship Scheme,Orphan students admitted to AICTE-approved institutions,Scholarship for orphan students pursuing technical education,https://www.aicte-india.org,Below 30,All,All India,Student,All Categories
Eklavya Model Residential Schools (EMRS),"ST students, selection through entrance examination",Quality education to tribal students with residential facilities,https://tribal.nic.in,Nov-18,All,All India,Student,ST
Dr. S. Radhakrishnan Post-Doctoral Fellowship in Humanities and Social Sciences,PhD degree holders below 35 years of age,Fellowship for pursuing post-doctoral research,https://www.ugc.ac.in,Below 35,All,All India,Researcher,All Categories
Vidyalakshmi Portal,Students seeking education loans for higher studies in India and abroad,Education loan portal for students,https://www.vidyalakshmi.co.in,17-35,All,All India,Student,All Categories
Financial Assistance for Education of the Wards of Beedi/Cine/IOMC/LSDM Workers,"Children of Beedi/Cine/IOMC/LSDM workers, family income criteria applicable",Scholarship for children of workers in specified industries,https://scholarships.gov.in,Jun-25,All,All India,Student,All Categories
CBSE Merit Scholarship Scheme for Single Girl Child,Only girl child in the family studying in classes XI-XII in CBSE-affiliated schools,Scholarship for single girl child studying in CBSE schools,https://cbse.nic.in,16-18,Female,All India,Student,All Categories
Post-Matric Scholarship for SC Students,"SC students with family income below Rs.2.5 lakh per annum, pursuing post-matriculation or post-secondary education","Financial assistance for SC students pursuing post-matriculation studies, covering tuition fees, maintenance allowance, etc.",https://scholarships.gov.in,16-24,All,All India,Student,SC
Central Sector Scheme of Scholarships for College and University Students,"Students in top 20 percentile in Class XII board exams, family income below Rs.8 lakh per annum","Provides 82,000 scholarships annually for undergraduate studies in sciences, humanities, commerce, and professional courses",https://scholarships.gov.in,Below 25,All,All India,Student,All Categories
National Scholarship Portal (NSP),Varies by specific scheme,Single window platform for multiple scholarship schemes from central and state governments,https://scholarships.gov.in,Jun-35,All,All India,Student,All Categories
Prime Minister's Research Fellowship (PMRF),"BTech/Integrated MTech/MSc from IITs, NITs, IISERs, IISc with CGPA 8.0 or above","Fellowship of Rs.70,000-80,000 per month plus research grant for pursuing PhD at IITs, IISERs, IISc",https://pmrf.in,No specific limit,All,All India,Student/Researcher,All Categories
National Talent Search Examination (NTSE),"Students of Class X, selection through two-stage written examination","Scholarship of Rs.1,250 per month for Class XI-XII and Rs.2,000 per month for undergraduates and postgraduates",https://ncert.nic.in/national-talent-examination.php,Below 18,All,All India,Student,All Categories
Merit-cum-Means Scholarship for Professional and Technical Courses,"Minority students (Muslims, Christians, Sikhs, Buddhists, Jains, Parsis) with family income below Rs.2.5 lakh per annum","Annual scholarship of Rs.20,000 for minority students in professional and technical courses",https://scholarships.gov.in,Below 30,All,All India,Student,Minorities
Pre-Matric Scholarship for Minorities,"Minority students (Muslims, Christians, Sikhs, Buddhists, Jains, Parsis) with family income below Rs.1 lakh per annum",Scholarship for minority students in classes I to X,https://scholarships.gov.in,Jun-15,All,All India,Student,Minorities
Kishore Vaigyanik Protsahan Yojana (KVPY),"Students in Class XI, XII, and first-year undergraduate science programs, selection through aptitude test and interview","Monthly scholarship ranging from Rs.5,000 to Rs.7,000 plus annual contingency grant",https://kvpy.iisc.ac.in,Below 22,All,All India,Student,All Categories
National Means-cum-Merit Scholarship (NMMS),"Students of Class VIII with family income below Rs.1.5 lakh per annum, selection through examination","Scholarship of Rs.12,000 per annum for four years for studies in classes IX to XII",https://mhrd.gov.in/nmms,13-15,All,All India,Student,All Categories
Pragati Scholarship Scheme for Girl Students,"Girl students admitted to AICTE-approved technical institutions, family income below Rs.8 lakh per annum","Scholarship of Rs.50,000 per annum for tuition fee and other expenses",https://www.aicte-pragati-saksham-gov.in,Below 30,Female,All India,Student,All Categories
Saksham Scholarship Scheme for Differently Abled Students,"Differently-abled students with 40% disability admitted to AICTE-approved technical institutions, family income below Rs.8 lakh per annum","Scholarship of Rs.50,000 per annum for tuition fee and other expenses",https://www.aicte-pragati-saksham-gov.in,Below 30,All,All India,Student,All Categories (Differently Abled)
Post-Matric Scholarship for OBC Students,OBC students with family income below Rs.1.5 lakh per annum,Financial assistance for pursuing studies after class X,https://scholarships.gov.in,16-32,All,All India,Student,OBC
Post-Matric Scholarship for ST Students,ST students with family income below Rs.2.5 lakh per annum,Financial assistance for ST students pursuing post-matriculation studies,https://scholarships.gov.in,16-32,All,All India,Student,ST
Credit Guarantee Fund Scheme for Education Loans (CGFSEL),"Students admitted to approved higher education institutions in India, family income criteria applicable",Guarantee for education loans up to Rs.7.5 lakh without collateral security and third-party guarantee,https://www.ncgtc.in,Below 35,All,All India,Student,All Categories
Swami Vivekananda Scholarship for Single Girl Child,"Only girl child in the family with no siblings, family income below specified limit",Scholarship for higher education to a single girl child in a family,https://www.ugc.ac.in,18-25,Female,All India,Student,All Categories
INSPIRE Scholarship for Higher Education (SHE),"Students in top 1% in Class XII board exams, pursuing science courses at bachelor's or master's level","Scholarship of Rs.80,000 per annum for pursuing Bachelor and Masters level education in natural and basic sciences",https://online-inspire.gov.in,17-22,All,All India,Student,All Categories
Ishan Uday Scholarship Scheme for North Eastern Region,"Students from North Eastern states with family income below Rs.8 lakh per annum, admitted through general entrance test","Scholarship of Rs.5,400-7,800 per month for general degree courses and technical/professional courses",https://scholarships.gov.in,Below 30,All,North Eastern States,Student,All Categories
Dr. Ambedkar Post-Matric Scholarship for Economically Backward Classes,Students from Economically Backward Classes (non-SC/ST/OBC) with family income below Rs.1 lakh per annum,Financial assistance for pursuing higher education,https://scholarships.gov.in,16-32,All,All India,Student,Economically Backward Classes
PG Scholarship for University Rank Holders,"Students securing first and second positions in undergraduate programs at universities, pursuing postgraduate courses","Scholarship of Rs.3,100 per month for two years for postgraduate studies",https://www.ugc.ac.in,Below 30,All,All India,Student,All Categories
Rajiv Gandhi National Fellowship for SC Students,SC students pursuing M.Phil/PhD with valid UGC-NET or CSIR-NET qualification,Fellowship for pursuing M.Phil and PhD programs,https://scholarships.gov.in,Below 35,All,All India,Student/Researcher,SC
Rajiv Gandhi National Fellowship for ST Students,ST students pursuing M.Phil/PhD with valid UGC-NET or CSIR-NET qualification,Fellowship for pursuing M.Phil and PhD programs,https://scholarships.gov.in,Below 35,All,All India,Student/Researcher,ST
Maulana Azad National Fellowship for Minority Students,Minority students pursuing M.Phil/PhD with valid UGC-NET or similar qualification,Fellowship for pursuing M.Phil and PhD programs,https://scholarships.gov.in,Below 35,All,All India,Student/Researcher,Minorities
National Fellowship for OBC Students,OBC students pursuing M.Phil/PhD with valid UGC-NET or CSIR-NET qualification,Fellowship for pursuing M.Phil and PhD programs,https://scholarships.gov.in,Below 35,All,All India,Student/Researcher,OBC
CSIR Junior Research Fellowship (JRF),Postgraduate students qualified in CSIR-UGC NET for JRF or GATE with specified cut-off marks,"Fellowship of Rs.31,000 per month for first two years and Rs.35,000 per month for remaining tenure",https://csirhrdg.res.in,Below 35,All,All India,Student/Researcher,All Categories
UGC Junior Research Fellowship (JRF),Postgraduate students qualified in UGC-NET for JRF,"Fellowship of Rs.31,000 per month for first two years and Rs.35,000 per month for remaining tenure",https://www.ugc.ac.in,Below 35,All,All India,Student/Researcher,All Categories
DBT Junior Research Fellowship (JRF),Postgraduate students qualified in DBT-JRF examination,Fellowship for research in biotechnology,https://dbtindia.gov.in,Below 35,All,All India,Student/Researcher,All Categories
e-Shodh Sindhu,Students and faculty of member institutions,Access to academic journals and digital resources for research,https://ess.inflibnet.ac.in,All ages,All,All India,Student/Researcher/Faculty,All Categories
National Sports Scholarship,Students with achievements in recognized sports events at national or international level,Scholarships for sports achievers pursuing education,https://yas.nic.in,Dec-25,All,All India,Student/Sportsperson,All Categories
GATE Scholarship,Students admitted to ME/MTech programs through GATE,"Scholarship of Rs.12,400 per month for ME/MTech students in AICTE-approved institutions",https://www.aicte-india.org,Below 35,All,All India,Student,All Categories
Lakshmi Bai Social Security Pension Scheme (Delhi),Girl students from families with annual income below Rs.1 lakh,Monthly pension and financial assistance for education to girl students in Delhi,https://scholarships.delhi.gov.in,Jun-18,Female,Delhi,Student,All Categories
Chief Minister Scholarship Scheme (Himachal Pradesh),"Students with 70% or above marks in qualifying examination, family income criteria applicable",Scholarship for meritorious students,https://himachal.nic.in,Below 25,All,Himachal Pradesh,Student,All Categories
Mukhyamantri Medhavi Vidyarthi Yojana (Madhya Pradesh),"Students with 75% or above marks in Class XII, family income below Rs.6 lakh per annum",Scholarship for higher education in professional courses,https://scholarshipportal.mp.nic.in,Below 25,All,Madhya Pradesh,Student,All Categories
Free Laptop Scheme (Tamil Nadu),Students enrolled in government and government-aided colleges and polytechnics,Free laptop distribution to students in government/aided colleges,https://www.tn.gov.in/scheme,18-25,All,Tamil Nadu,Student,All Categories
Mukhyamantri Yuva Swarozgar Yojana (Uttarakhand),"Graduates/diploma holders from recognized institutions, residents of Uttarakhand",Financial assistance and loan for entrepreneurship,https://uttarakhand.gov.in,18-35,All,Uttarakhand,Student/Entrepreneur,All Categories
Mukhyamantri Rajshri Yojana (Rajasthan),"Girl students from Rajasthan, family income criteria applicable",Financial assistance for girl students at different stages of education,https://rajshri.rajasthan.gov.in,Jun-24,Female,Rajasthan,Student,All Categories
Mukhyamantri Kanya Utthan Yojana (Bihar),"Girl students from Bihar, family income criteria applicable",Financial assistance for girl students at different stages of education,https://wcd.bihar.gov.in,Below 25,Female,Bihar,Student,All Categories
Dr. Ambedkar Medhavi Vidyarthi Yojana (Uttar Pradesh),"Students with 60% or above marks in qualifying examination, family income below Rs.2 lakh per annum",Scholarship for meritorious students,https://scholarship.up.nic.in,Below 30,All,Uttar Pradesh,Student,All Categories
Gyanodaya Scheme (Gujarat),Girl students in rural areas studying in Class 9,Free bicycle distribution to girl students,https://education.gujarat.gov.in,14-16,Female,Gujarat,Student,All Categories
Pragati Scholarship (AICTE),"Girl students admitted to AICTE-approved institutions, family income below Rs.8 lakh per annum",Scholarship for girls pursuing technical education,https://www.aicte-india.org,Below 30,Female,All India,Student,All Categories
Mukhyamantri Balak & Balika Protsahan Yojana (Haryana),Students with specified attendance and academic performance,Cash incentives for students at different educational levels,https://scholarships.gov.in,Jun-18,All,Haryana,Student,All Categories
Pre-Matric Scholarship for SC Students,SC students with family income below Rs.2.5 lakh per annum,Financial assistance for SC students in classes IX and X,https://scholarships.gov.in,14-16,All,All India,Student,SC
Pre-Matric Scholarship for ST Students,ST students with family income below Rs.2.5 lakh per annum,Financial assistance for ST students in classes IX and X,https://scholarships.gov.in,14-16,All,All India,Student,ST
AICTE SWANATH Scholarship Scheme,Orphan students admitted to AICTE-approved institutions,Scholarship for orphan students pursuing technical education,https://www.aicte-india.org,Below 30,All,All India,Student,All Categories
Eklavya Model Residential Schools (EMRS),"ST students, selection through entrance examination",Quality education to tribal students with residential facilities,https://tribal.nic.in,Nov-18,All,All India,Student,ST
Dr. S. Radhakrishnan Post-Doctoral Fellowship in Humanities and Social Sciences,PhD degree holders below 35 years of age,Fellowship for pursuing post-doctoral research,https://www.ugc.ac.in,Below 35,All,All India,Researcher,All Categories
Vidyalakshmi Portal,Students seeking education loans for higher studies in India and abroad,Education loan portal for students,https://www.vidyalakshmi.co.in,17-35,All,All India,Student,All Categories
Financial Assistance for Education of the Wards of Beedi/Cine/IOMC/LSDM Workers,"Children of Beedi/Cine/IOMC/LSDM workers, family income criteria applicable",Scholarship for children of workers in specified industries,https://scholarships.gov.in,Jun-25,All,All India,Student,All Categories
CBSE Merit Scholarship Scheme for Single Girl Child,Only girl child in the family studying in classes XI-XII in CBSE-affiliated schools,Scholarship for single girl child studying in CBSE schools,https://cbse.nic.in,16-18,Female,All India,Student,All Categories
Pradhan Mantri Ujjwala Yojana,Women from BPL households,Provides LPG connections to women from below poverty line households,https://pmuy.gov.in/,18+,Female,All India,Any,All
Pradhan Mantri Awas Yojana - Urban,Urban poor with annual income up to Rs. 3 lakh,Housing for All scheme to provide affordable housing to urban poor,https://pmaymis.gov.in/,18+,All,All India,Any,EWS/LIG/MIG
Pradhan Mantri Awas Yojana - Gramin,Rural households with kutcha houses,Housing scheme for rural population to provide pucca houses,https://pmayg.nic.in/,18+,All,All India,Any,All
Ayushman Bharat Pradhan Mantri Jan Arogya Yojana,Economically weaker sections,Health insurance coverage of Rs. 5 lakh per family per year,https://pmjay.gov.in/,All,All,All India,Any,Economically weaker sections
Pradhan Mantri Kisan Samman Nidhi,Small and marginal farmers with less than 2 hectares of land,Income support of Rs. 6000 per year in three equal installments,https://pmkisan.gov.in/,18+,All,All India,Farmer,All
National Social Assistance Program,Elderly persons/widows/disabled persons below poverty line,Social security scheme providing financial assistance to elderly/widows/disabled,https://nsap.nic.in/,60+ (elderly)/40+ (widows)/18+ (disabled),All,All India,Any,BPL
Sukanya Samriddhi Yojana,Girl child under 10 years,Small savings scheme for girl child education and marriage expenses,https://www.nsiindia.gov.in/InternalPage.aspx?Id_Pk=55,Below 10,Female,All India,Any,All
Atal Pension Yojana,Unorganized sector workers aged 18-40 years,Pension scheme for unorganized sector providing guaranteed pension between Rs. 1000-5000,https://www.npscra.nsdl.co.in/nsdl/scheme-details/apy,18-40,All,All India,Unorganized Sector,All
Pradhan Mantri Mudra Yojana,Small entrepreneurs,Provides loans up to Rs. 10 lakh for non-farm income generating activities,https://www.mudra.org.in/,18+,All,All India,Small Business Owner,All
Pradhan Mantri Suraksha Bima Yojana,Bank account holders aged 18-70,Accident insurance scheme offering coverage of Rs. 2 lakh,https://www.jansuraksha.gov.in/,18-70,All,All India,Any,All
